BELL PLANTATION,PB2 POWDER PEANUT BUTTER 6.5oz
BELL PLANTATION,PB2 POWDER PNUT BTTR/CHC 6.5oz
BELL PLANTATION,PB2 POWDER PNUT BTTR/STR 6.5oz
BIONUTRITIONAL RESEARCH,CHOKLAT CRUNCH DRK CHOC 12/BX
BIONUTRITIONAL RESEARCH,POWER CRUNCH BERRY CREME 12/BX
BIONUTRITIONAL RESEARCH,POWER CRUNCH CHOCOLATE MINT 12
BIONUTRITIONAL RESEARCH,POWER CRUNCH COOKIE&CRM 12/BOX
BIONUTRITIONAL RESEARCH,POWER CRUNCH CRISP CHOC 12/BX
BIONUTRITIONAL RESEARCH,POWER CRUNCH CRISP SLT CRML12/
BIONUTRITIONAL RESEARCH,POWER CRUNCH FRENCH VAN 12/BX
BIONUTRITIONAL RESEARCH,POWER CRUNCH PB CREME 12/BOX
BIONUTRITIONAL RESEARCH,POWER CRUNCH SALTD CARAMEL 12/
BIONUTRITIONAL RESEARCH,POWER CRUNCH TRIPLE CHOC 12/BX
"CLIF BAR, INC.",CLIF BAR APRICOT 12/BX
"CLIF BAR, INC.",CLIF BAR BANANA NUT BREAD 12/B
"CLIF BAR, INC.",CLIF BAR CARROT CAKE 12/BX
"CLIF BAR, INC.",CLIF BAR COCONUT CHC CHIP 12/B
"CLIF BAR, INC.",CLIF BAR WHT CHC MACADAMIA 12/
"CLIF BAR, INC.",CLIF BUILDER BAR CHC HZLNT12/B
"CLIF BAR, INC.",CLIF BUILDER BAR VAN ALMND 12/
"CLIF BAR, INC.",CLIF SHOT GEL RASPBERRY 24/BOX
EAS,100% WHEY CHOCOLATE 5LB
EAS,100% WHEY VANILLA 5LB
EAS,MYOPLEX 20/PK CHOC.
EAS,MYOPLEX 20/PK STRAW
EAS,MYOPLEX 20/PK VANILLA
EAS,MYOPLEX 42/PK CHOC
EAS,MYOPLEX LITE 20/PK VANILLA
EAT THE BEAR,ETB NATURALLY CHOCOLATE 1.62LB
EAT THE BEAR,ETB NATURALLY VANILLA 1.62LB
EAT THE BEAR,GRIZZLY ISOLATE CINNAMON 2LB
EAT THE BEAR,GRIZZLY ISOLATE ICE CRM 2LBS
FIT & FRESH,7 DAY PILL ORGANIZER
FIT & FRESH,FOOD SCALE
FIT & FRESH,POCKET PILL CASE
FIT & FRESH,PORTABLE POD W/ORGANIZING TRAY
FIT & FRESH,SEVEN PACK PLUS VITN ORG
FIT & FRESH,VITAMIN CHEST VITMN ORGNZR
GAMMA ENTERPRISES,G FUEL LEMON LIME 40/SRV
GAMMA ENTERPRISES,G FUEL PINK LEMONADE 40/SRV
GAMMA ENTERPRISES,G FUEL TROPICAL RAIN 40/SERV
GROWING NATURALS,ORGANIC RICE PROTEIN CHOC 1LB
GROWING NATURALS,ORGANIC RICE PROTEIN CHOC 2LB
GROWING NATURALS,ORGANIC RICE PROTEIN ORIGNL2LB
GROWING NATURALS,PEA PROTEIN ORIGINAL 1LB 24/SR
PURUS LABS,D-POL PWDR CUSTARD CREME 30/SR
PURUS LABS,NOXYGEN 40/SERVINGS
